Timestamp,Property Title,Location,Type,Price,Price Label,Size,Bedrooms,Key Feature,Description,"Photo 1
",Photo 2,Photo 3,Photo 4,Photo 5,YouTube Video URL,Status
7/12/2026 15:25:00,3 BHK House in Madikeri,Madikeri,Villa,1.40 Cr (negotiable),,,,,"3 BHK House for Sale – ₹1.40 Crore

Own a beautiful 3 BHK house in one of Madikeri's most well-known and sought-after residential layouts. Ideally located on the main road and just minutes from the town, this property offers excellent accessibility and convenience.

The house is spacious, well-maintained, and situated in a prime location with easy access to schools, hospitals, supermarkets, and other essential amenities. Whether you're looking for a comfortable family home or a valuable investment, this property is an excellent choice.

Price: ₹1.40 Crore
Location: Prime layout, Main Road, Madikeri",https://drive.google.com/open?id=1a8sxGVYU6p8G0XCo_bEOpwo8c46Z5A2k,https://drive.google.com/open?id=1v5QH6mxo_sfDl58KEdXc2_4d9BgBET_h,https://drive.google.com/open?id=1DgDWClSjlbjF-_mWkPXzXnnNrbKvegiU,https://drive.google.com/open?id=1EIbuqdMxPMUWlvs6U6x2f540-5fWMYbk,,,Active
7/13/2026 12:02:40,Commercial Property for Sale,Madikeri,Commercial,Available on Call,,,,,"Investing in commercial property offers a powerful opportunity to generate steady income and long-term wealth. With higher rental yields, longer lease terms, and strong appreciation potential, commercial real estate provides more stability than many other investments. It’s a smart way to diversify your portfolio, gain control over your assets, and benefit from the growing demand for quality business spaces.",https://drive.google.com/open?id=1euR8CnTi2TGS7r69BwoQHsBhZQW1hEKh,https://drive.google.com/open?id=1l-MkrCt-AhEzKTaM56w7yu7rP72Id8oH,https://drive.google.com/open?id=1kzkiXWY6kMva6ExBii5oiACjQk3VgKyk,,,,Sold
7/13/2026 12:04:53,Homestay for Sale,Madikeri,Villa,Available on call. ,,,,,"Own your slice of paradise! This charming homestay, nestled on 5 cents of lush land, offers a peaceful escape with great earning potential. Thoughtfully designed, it’s ideal for weekend getaways or Airbnb rentals. Whether you're looking to invest or settle down, this property is the perfect blend of comfort, nature, and opportunity. Ready to move in and start earning from day one, Contact +91-9632288853 for more info.",https://drive.google.com/open?id=1rdw0OsLE6j2dNfL1yZA1_v1xOjs7Avfr,https://drive.google.com/open?id=1VVyxN-s3MuF5S2EChUPLkzfVcE6gyOEP,https://drive.google.com/open?id=12rKEZnl_JswvKewiv_rUTOOjzbIOGydm,,,,Active
7/13/2026 12:06:06,20 Acres Resort,Kushalnagar,Estate,Available on Call,,,,,"Escape into luxury with this rare opportunity to own a 20-acre resort estate! Surrounded by lush greenery, scenic views, and tranquil vibes, this property is perfect for a boutique resort, wellness retreat, or premium holiday destination. With ample space for expansion, private trails, and nature at its best, it's where serenity meets potential. 
More info? Contact +91-9632288853.",https://drive.google.com/open?id=1ICCkaqLyjGSKRWcrNLogRPy7zgX_WK5v,https://drive.google.com/open?id=1vqO4sEncAI7vAV-_KQT9-GtFdnJn8K0I,https://drive.google.com/open?id=1crBFCUbwRX8bT_DvPM2IGl0RrMJoH206,,,,Active
7/13/2026 12:08:05,House for Sale,Madikeri,Villa,Available on call,,,,,"Discover your dream home in the heart of Madikeri’s most sought-after neighborhood! This elegant house, set on 4.5 cents of prime land, blends modern comfort with serene charm. it offers the perfect escape for peaceful living or a premium investment. With close access to schools, markets, and tourist spots, this house is ideal for families or as a luxury homestay. A rare opportunity to own a piece of Madikeri's finest. Contact +9632288853 for more info!",https://drive.google.com/open?id=1r-KJotvHg93TDhdILzDtmDH1wMoQ3z-E,https://drive.google.com/open?id=1SORxmbawmnHGb5-JlLmr2wRi0RXCTNKb,https://drive.google.com/open?id=1d9JWTmC5lQfZ-Ysk58MBMtx43ke2XUuv,,,,Active